id,title,slug,image,video_path,description,ingredients,instructions,tags,prep_time,cook_time,servings,difficulty,rating,category,status,views,likes,created_at,updated_at,video_url,video_file
1,Spinach Artichoke Dip,spinach-artichoke-dip,images/spinach-dip.jpg,,Creamy cheesy dip with spinach and artichoke hearts perfect with tortilla chips or bread,1 package (8 oz) cream cheese softened||1/4 cup mayonnaise||1/4 cup sour cream||1/4 cup grated Parmesan cheese||1/4 cup grated Romano cheese||2 cloves garlic minced||1/2 teaspoon dried basil||1/4 teaspoon garlic salt||Salt and pepper to taste||1 can (14 oz) artichoke hearts drained and chopped||1 package (10 oz) frozen chopped spinach thawed and squeezed dry||1/2 cup shredded mozzarella cheese,Preheat oven to 350°F (175°C)||In a large bowl mix cream cheese mayonnaise sour cream Parmesan cheese Romano cheese garlic basil and garlic salt until well blended||Stir in artichoke hearts and spinach||Transfer mixture to a 9-inch pie plate or a small baking dish||Sprinkle with mozzarella cheese||Bake for 20-25 minutes until bubbly and lightly browned||Serve warm with tortilla chips pita chips or sliced baguette,vegetarian,party food,make ahead,25,20,8,Medium,4.7,appetizer,published,245,89,2024-01-15 10:30:00,2024-01-15 10:30:00,,
2,Stuffed Mushrooms,stuffed-mushrooms,images/stuffed-mushrooms.jpg,,Mushroom caps filled with a savory mixture of cream cheese herbs and garlic,24 whole fresh mushrooms stems removed||1 tablespoon vegetable oil||1 tablespoon minced garlic||8 oz cream cheese softened||1/4 cup grated Parmesan cheese||1/4 teaspoon black pepper||1/4 teaspoon onion powder||1/4 teaspoon ground cayenne pepper||2 tablespoons fresh parsley chopped||1/4 cup bread crumbs,Preheat oven to 350°F (175°C)||Clean mushrooms and carefully remove stems||Heat oil in a skillet over medium heat Add garlic and mushroom stems and cook until any moisture has evaporated||In a bowl combine cream cheese Parmesan cheese black pepper onion powder and cayenne pepper||Add cooked mushroom stems and garlic to the bowl and mix well||Fill each mushroom cap with the mixture and place on a baking sheet||Sprinkle with bread crumbs||Bake for 20 minutes until the mushrooms are tender and the filling is golden brown||Garnish with fresh parsley before serving,vegetarian,party food,appetizer,30,20,12,Medium,4.6,appetizer,published,198,76,2024-01-15 11:00:00,2024-01-15 11:00:00,,
3,Honey Garlic Chicken Wings,honey-garlic-chicken-wings,images/chicken-wings.jpg,,Sweet and sticky chicken wings coated in a delicious honey garlic sauce,2 lbs chicken wings||2 tablespoons olive oil||1/2 teaspoon salt||1/2 teaspoon black pepper||2 teaspoons garlic powder||1/4 cup honey||1/4 cup soy sauce||3 cloves garlic minced||1 tablespoon ginger grated||2 tablespoons sriracha sauce (optional)||1 tablespoon sesame seeds (for garnish)||Green onions chopped (for garnish),Preheat oven to 400°F (200°C)||In a large bowl toss chicken wings with olive oil salt pepper and garlic powder||Arrange wings on a baking sheet lined with parchment paper||Bake for 35-40 minutes turning halfway through until crispy and cooked through||While wings are baking prepare the sauce In a small saucepan combine honey soy sauce minced garlic ginger and sriracha (if using)||Simmer over medium heat for about 5 minutes until slightly thickened||When wings are done toss them in the sauce until well coated||Return to the oven for an additional 5 minutes||Garnish with sesame seeds and chopped green onions before serving,chicken,party food,spicy,15,45,4,Easy,4.9,appetizer,published,342,156,2024-01-15 11:30:00,2024-01-15 11:30:00,,
4,Vegetable Spring Rolls,vegetable-spring-rolls,images/spring-rolls.jpg,,Crispy spring rolls filled with fresh vegetables and served with sweet chili sauce,12 spring roll wrappers||2 cups cabbage shredded||1 carrot julienned||1/2 red bell pepper julienned||2 green onions chopped||1 cup bean sprouts||2 tablespoons soy sauce||1 tablespoon sesame oil||1 teaspoon ginger grated||2 cloves garlic minced||Vegetable oil for frying||Sweet chili sauce for dipping,In a large bowl combine cabbage carrot bell pepper green onions and bean sprouts||In a small bowl mix soy sauce sesame oil ginger and garlic||Pour sauce over vegetables and toss to combine||Place a spring roll wrapper on a clean surface with a corner pointing toward you||Place about 2 tablespoons of the filling near the corner closest to you||Fold the corner over the filling then fold in the sides and roll tightly Seal the edge with a little water||Repeat with remaining wrappers and filling||Heat vegetable oil in a deep pan to 350°F (175°C)||Fry spring rolls in batches until golden brown about 3-4 minutes per batch||Drain on paper towels and serve with sweet chili sauce,vegetarian,vegan,asian,40,10,6,Medium,4.5,appetizer,published,167,62,2024-01-15 12:00:00,2024-01-15 12:00:00,,
5,Fresh Guacamole,fresh-guacamole,images/guacamole.jpg,,Simple and delicious guacamole with ripe avocados lime juice and fresh cilantro,3 ripe avocados||1 lime juiced||1 small onion finely diced||2 Roma tomatoes diced||3 tablespoons fresh cilantro chopped||2 cloves garlic minced||1 jalapeño seeded and minced (optional)||1/2 teaspoon salt||1/4 teaspoon ground cumin||Tortilla chips for serving,Cut avocados in half remove pits and scoop flesh into a bowl||Mash avocados with a fork to desired consistency (some like it chunky others smooth)||Add lime juice and mix well to prevent browning||Stir in onion tomatoes cilantro garlic and jalapeño (if using)||Season with salt and cumin||Taste and adjust seasoning if needed||Serve immediately with tortilla chips or refrigerate with plastic wrap pressed directly on the surface to prevent browning,vegetarian,vegan,mexican,quick,10,0,6,Easy,4.8,appetizer,published,289,134,2024-01-15 12:30:00,2024-01-15 12:30:00,,
6,Crispy Mozzarella Sticks,crispy-mozzarella-sticks,images/mozzarella-sticks.jpg,,Golden and crispy on the outside with gooey melted cheese inside these homemade mozzarella sticks are irresistible,12 mozzarella string cheese sticks||1 cup all-purpose flour||2 eggs beaten||2 tablespoons milk||1 cup breadcrumbs||1 tablespoon Italian seasoning||1/2 teaspoon garlic powder||1/2 teaspoon salt||Vegetable oil for frying||Marinara sauce for dipping,Cut each string cheese in half to make 24 pieces Freeze for 30 minutes||Set up three bowls one with flour one with beaten eggs and milk and one with breadcrumbs mixed with Italian seasoning garlic powder and salt||Dip each cheese stick in flour then egg mixture then breadcrumbs||Dip in egg mixture again then breadcrumbs for a second coating||Return to freezer for at least 30 minutes or up to overnight||Heat oil to 350°F (175°C) in a deep fryer or heavy pot||Fry cheese sticks in batches for 30-45 seconds until golden brown||Drain on paper towels and serve immediately with marinara sauce,vegetarian,party food,cheese,kid-friendly,20,15,6,Medium,4.7,appetizer,published,412,187,2024-01-15 13:00:00,2024-01-15 13:00:00,,
7,Bacon Wrapped Dates,bacon-wrapped-dates,images/bacon-dates.jpg,,Sweet dates filled with creamy goat cheese and wrapped in crispy bacon for an irresistible sweet and savory bite,24 Medjool dates pitted||4 oz goat cheese||12 slices bacon cut in half||24 toothpicks||1 tablespoon honey (optional)||1/4 teaspoon cracked black pepper,Preheat oven to 400°F (200°C) Line a baking sheet with parchment paper||Stuff each date with a small amount of goat cheese||Wrap each stuffed date with a half slice of bacon and secure with a toothpick||Arrange on baking sheet leaving space between each date||Bake for 15-20 minutes until bacon is crisp turning halfway through||Transfer to a serving platter drizzle with honey if desired and sprinkle with black pepper||Serve warm,gluten-free,party food,sweet and savory,10,25,12,Easy,4.9,appetizer,published,356,165,2024-01-15 13:30:00,2024-01-15 13:30:00,,
8,Classic Shrimp Cocktail,classic-shrimp-cocktail,images/shrimp-cocktail.jpg,,Perfectly cooked shrimp served with a tangy homemade cocktail sauce a timeless appetizer for any gathering,1 lb large shrimp peeled and deveined (tails left on)||2 quarts water||1 lemon halved||2 bay leaves||1 tablespoon salt||1 cup ketchup||2 tablespoons prepared horseradish||1 tablespoon lemon juice||1 teaspoon Worcestershire sauce||1/2 teaspoon hot sauce||Lemon wedges for garnish||Fresh parsley for garnish,In a large pot combine water juice from half of the lemon bay leaves and salt Bring to a boil||Add the shrimp and cook just until pink and opaque about 2-3 minutes||Immediately transfer shrimp to a bowl of ice water to stop the cooking process||In another bowl mix ketchup horseradish lemon juice Worcestershire sauce and hot sauce||Drain and pat dry the shrimp||Arrange shrimp on a serving platter with a small bowl of cocktail sauce in the center||Garnish with lemon wedges and fresh parsley,seafood,gluten-free,classic,15,5,4,Easy,4.6,appetizer,published,278,112,2024-01-15 14:00:00,2024-01-15 14:00:00,,
9,Jalapeno Poppers,jalapeno-poppers,images/jalapeno-poppers.jpg,,Spicy jalapeños stuffed with cream cheese and cheddar wrapped in bacon and baked until crispy,12 large jalapeño peppers||8 oz cream cheese softened||1 cup shredded cheddar cheese||2 green onions finely chopped||1/2 teaspoon garlic powder||1/2 teaspoon onion powder||12 slices bacon cut in half||Toothpicks,Preheat oven to 400°F (200°C) Line a baking sheet with foil and place a wire rack on top||Cut jalapeños in half lengthwise and remove seeds and membranes (wear gloves!)||In a bowl combine cream cheese cheddar cheese green onions garlic powder and onion powder||Fill each jalapeño half with the cheese mixture||Wrap each stuffed jalapeño with a half slice of bacon and secure with a toothpick||Place on the prepared wire rack||Bake for 20-25 minutes until bacon is crispy and cheese is bubbly||Allow to cool slightly before serving,spicy,gluten-free,party food,20,30,12,Medium,4.8,appetizer,published,389,178,2024-01-15 14:30:00,2024-01-15 14:30:00,,
10,Caprese Skewers,caprese-skewers,images/caprese-skewers.jpg,,Simple yet elegant appetizer featuring fresh mozzarella tomatoes and basil drizzled with balsamic glaze,24 cherry tomatoes||12 oz fresh mozzarella pearls||24 fresh basil leaves||1/4 cup extra virgin olive oil||2 tablespoons balsamic glaze||Salt and pepper to taste||24 small skewers or toothpicks,Thread one cherry tomato one basil leaf (folded in half) and one mozzarella pearl onto each skewer||Arrange on a serving platter||Drizzle with olive oil and balsamic glaze||Season with salt and pepper||Serve immediately or refrigerate until ready to serve,vegetarian,gluten-free,italian,quick,no-cook,15,0,12,Easy,4.5,appetizer,published,298,143,2024-01-15 15:00:00,2024-01-15 15:00:00,,
11,BBQ Meatballs,bbq-meatballs,images/bbq-meatballs.jpg,,Juicy meatballs simmered in a tangy homemade BBQ sauce perfect for serving with toothpicks at parties,1 lb ground beef||1/2 lb ground pork||1/2 cup breadcrumbs||1/4 cup milk||1 egg beaten||1/4 cup onion finely diced||2 cloves garlic minced||1 teaspoon salt||1/2 teaspoon black pepper||1 cup ketchup||1/2 cup brown sugar||2 tablespoons apple cider vinegar||1 tablespoon Worcestershire sauce||1 teaspoon smoked paprika||1/2 teaspoon cayenne pepper (optional),Preheat oven to 375°F (190°C) Line a baking sheet with parchment paper||In a bowl combine breadcrumbs and milk Let sit for 5 minutes||Add ground beef ground pork egg onion garlic salt and pepper Mix until just combined||Form mixture into 1-inch meatballs and place on baking sheet||Bake for 20-25 minutes until cooked through||Meanwhile in a saucepan combine ketchup brown sugar vinegar Worcestershire sauce paprika and cayenne (if using)||Simmer over medium heat for 5 minutes stirring occasionally||Transfer cooked meatballs to a slow cooker or large pot cover with sauce and simmer for 10 minutes||Serve warm with toothpicks,meat,party food,make ahead,25,40,8,Medium,4.7,appetizer,published,367,152,2024-01-15 15:30:00,2024-01-15 15:30:00,,
12,Crab Rangoon,crab-rangoon,images/crab-rangoon.jpg,,Crispy wontons filled with a creamy crab and cream cheese mixture a popular Chinese-American appetizer,8 oz cream cheese softened||6 oz canned crab meat drained and flaked||2 green onions finely chopped||1 clove garlic minced||1 teaspoon Worcestershire sauce||1/2 teaspoon soy sauce||24 wonton wrappers||1 egg beaten (for sealing)||Vegetable oil for frying||Sweet and sour sauce for dipping,In a bowl combine cream cheese crab meat green onions garlic Worcestershire sauce and soy sauce||Place a wonton wrapper on a flat surface and add about 1 tablespoon of filling to the center||Brush the edges with beaten egg then fold the wrapper diagonally to form a triangle Press the edges to seal||Bring the two opposite corners together and press to seal (should look like a little purse)||Repeat with remaining wrappers and filling||Heat oil to 350°F (175°C) in a deep fryer or heavy pot||Fry rangoons in batches until golden brown about 2-3 minutes||Drain on paper towels and serve hot with sweet and sour sauce,seafood,asian,fried,25,35,12,Medium,4.8,appetizer,published,234,98,2024-01-15 16:00:00,2024-01-15 16:00:00,,
13,Deviled Eggs,deviled-eggs,images/deviled-eggs.jpg,,Creamy tangy deviled eggs garnished with paprika a timeless and elegant appetizer for any occasion,12 large eggs||1/2 cup mayonnaise||1 tablespoon Dijon mustard||1 tablespoon white vinegar||1/4 teaspoon salt||1/8 teaspoon black pepper||Paprika for garnish||Fresh chives chopped (optional),Place eggs in a single layer in a saucepan and cover with water about 1 inch above eggs||Bring to a boil then remove from heat cover and let sit for 12 minutes||Transfer eggs to an ice bath to cool then peel||Cut eggs in half lengthwise and remove yolks to a bowl||Mash yolks with a fork then add mayonnaise mustard vinegar salt and pepper Mix until smooth||Spoon or pipe the yolk mixture back into the egg whites||Sprinkle with paprika and chives (if using)||Refrigerate until ready to serve,vegetarian,gluten-free,classic,keto,15,25,12,Easy,4.6,appetizer,published,445,201,2024-01-15 16:30:00,2024-01-15 16:30:00,,
14,Hummus Platter,hummus-platter,images/hummus-platter.jpg,,Creamy homemade hummus served with an assortment of vegetables olives and pita bread for dipping,2 cans (15 oz each) chickpeas drained and rinsed||1/3 cup tahini||1/4 cup lemon juice||3 cloves garlic minced||2 tablespoons olive oil plus more for drizzling||1/2 teaspoon ground cumin||1/2 teaspoon salt||2-3 tablespoons water||Paprika for garnish||Fresh parsley chopped||Assorted vegetables for dipping (carrots cucumbers bell peppers)||Kalamata olives||Feta cheese crumbled||Pita bread cut into wedges,In a food processor combine chickpeas tahini lemon juice garlic olive oil cumin and salt||Process until smooth adding water as needed to reach desired consistency||Transfer hummus to a serving bowl and create a well in the center||Drizzle with olive oil and sprinkle with paprika and parsley||Arrange vegetables olives feta cheese and pita wedges around the hummus||Serve immediately or refrigerate until ready to serve,vegetarian,mediterranean,healthy,make ahead,20,0,6,Easy,4.7,appetizer,published,312,167,2024-01-15 17:00:00,2024-01-15 17:00:00,,
15,Loaded Potato Skins,loaded-potato-skins,images/potato-skins.jpg,,Crispy potato skins loaded with cheese bacon and green onions topped with sour cream for the ultimate comfort food appetizer,6 medium russet potatoes scrubbed clean||2 tablespoons olive oil||1 tablespoon salt||1/2 teaspoon garlic powder||1/2 teaspoon paprika||1 1/2 cups shredded cheddar cheese||8 slices bacon cooked and crumbled||4 green onions sliced||1/2 cup sour cream||Black pepper to taste,Preheat oven to 400°F (200°C) Poke potatoes with a fork and rub with 1 tablespoon of olive oil||Bake potatoes directly on oven rack for 45-60 minutes until tender Let cool slightly||Cut potatoes in half lengthwise and scoop out the middle leaving about 1/4 inch of potato on the skin||Increase oven temperature to 450°F (230°C)||Brush both sides of potato skins with remaining olive oil and place skin-side up on a baking sheet||Sprinkle with salt garlic powder and paprika||Bake for 10 minutes then flip and bake another 10 minutes until crispy||Fill each skin with cheese and bacon then return to oven for 2-3 minutes until cheese melts||Top with green onions and a dollop of sour cream Season with black pepper,gluten-free,party food,comfort food,30,50,12,Medium,4.9,appetizer,published,478,243,2024-01-15 17:30:00,2024-01-15 17:30:00,,
16,Ultimate Nachos,ultimate-nachos,images/nachos.jpg,,Crispy tortilla chips loaded with beans cheese jalapeños and fresh toppings for a crowd-pleasing appetizer,12 oz tortilla chips||1 can (15 oz) black beans drained and rinsed||1 can (15 oz) refried beans||2 cups shredded Mexican blend cheese||1 cup chunky salsa||1/2 cup black olives sliced||2 jalapeños sliced (seeds removed for less heat)||1 tomato diced||1/2 red onion finely diced||1 avocado diced||1/4 cup fresh cilantro chopped||1/2 cup sour cream||1 lime cut into wedges,Preheat oven to 375°F (190°C)||Spread tortilla chips in a single layer on a large oven-safe platter or baking sheet||In a small bowl mix black beans and refried beans then spread over chips||Sprinkle cheese evenly over the beans and chips||Bake for 5-7 minutes until cheese is fully melted||Remove from oven and top with salsa olives jalapeños tomato red onion and avocado||Garnish with fresh cilantro and serve with sour cream and lime wedges on the side,vegetarian,mexican,party food,15,20,6,Easy,4.8,appetizer,published,523,289,2024-01-15 18:00:00,2024-01-15 18:00:00,,
17,Fruit Skewers with Honey Yogurt Dip,fruit-skewers-honey-yogurt,images/fruit-skewers.jpg,,Colorful skewers of fresh seasonal fruits served with a sweet honey yogurt dipping sauce,1 pineapple cut into chunks||2 cups strawberries hulled||2 kiwis peeled and cut into chunks||1 cantaloupe cut into chunks||1 cup red grapes||1 cup green grapes||2 bananas sliced into 1-inch pieces||1 cup plain Greek yogurt||3 tablespoons honey||1 teaspoon vanilla extract||1/4 teaspoon cinnamon||12-15 wooden skewers,Thread various fruit pieces onto wooden skewers alternating colors for visual appeal||Arrange skewers on a serving platter||In a small bowl mix Greek yogurt honey vanilla extract and cinnamon until well combined||Serve fruit skewers with yogurt dip on the side||For best results prepare just before serving to keep fruit fresh,vegetarian,healthy,gluten-free,no-cook,15,0,6,Easy,4.6,appetizer,published,187,95,2024-01-15 18:30:00,2024-01-15 18:30:00,,
18,Crispy Falafel Bites,crispy-falafel-bites,images/falafel-bites.jpg,,Crispy bite-sized falafel patties served with a creamy tahini sauce for dipping,2 cups canned chickpeas drained and rinsed||1/2 onion roughly chopped||3 cloves garlic||1/4 cup fresh parsley||1/4 cup fresh cilantro||1 teaspoon cumin||1 teaspoon coriander||1/2 teaspoon baking soda||3 tablespoons all-purpose flour||1 teaspoon salt||1/2 teaspoon black pepper||Vegetable oil for frying||1/4 cup tahini||2 tablespoons lemon juice||1 clove garlic minced||3 tablespoons water||Salt to taste,In a food processor combine chickpeas onion garlic parsley and cilantro Pulse until finely minced but not pureed||Transfer mixture to a bowl and add cumin coriander baking soda flour salt and pepper Mix well||Form mixture into small balls about 1 inch in diameter then flatten slightly||Heat oil in a deep pan to 350°F (175°C)||Fry falafel in batches until golden brown about 2-3 minutes per batch||Drain on paper towels||For the tahini sauce whisk together tahini lemon juice minced garlic water and salt until smooth||Serve falafel bites hot with tahini sauce for dipping,vegetarian,vegan,mediterranean,25,40,6,Medium,4.7,appetizer,published,223,118,2024-01-15 19:00:00,2024-01-15 19:00:00,,
19,Mushroom Turnovers,mushroom-turnovers,images/mushroom.jepg,,Flaky pastry turnovers filled with a savory mushroom and herb mixture,2 sheets puff pastry thawed||1 lb mushrooms (cremini or button) finely chopped||2 tablespoons olive oil||3 cloves garlic minced||2 shallots finely chopped||2 tablespoons fresh thyme leaves||1 tablespoon fresh rosemary chopped||1/4 cup vegetable broth||2 tablespoons all-purpose flour||1/4 cup cream cheese||1/2 teaspoon salt||1/4 teaspoon black pepper||1 egg beaten (for egg wash)||Sesame seeds for garnish,Preheat oven to 400°F (200°C) Line a baking sheet with parchment paper||In a large skillet heat olive oil over medium heat Add shallots and cook until softened about 2 minutes||Add mushrooms and garlic cook until mushrooms release their moisture and it evaporates about 7-8 minutes||Stir in thyme and rosemary Sprinkle flour over mixture and stir to combine||Add vegetable broth and cook until thickened about 2 minutes||Remove from heat stir in cream cheese until melted Season with salt and pepper Let cool||Roll out puff pastry sheets and cut each into 9 equal squares||Place a spoonful of mushroom mixture in the center of each square||Fold pastry over filling to form triangles and seal edges with a fork||Brush with beaten egg and sprinkle with sesame seeds||Bake for 15-20 minutes until golden brown and puffed||Allow to cool slightly before serving,vegetarian,party food,make ahead,30,45,12,Medium,4.5,appetizer,published,156,87,2024-01-15 19:30:00,2024-01-15 19:30:00,,
20,Crispy Samosas,crispy-samosas,images/samosas.jpg,,Crispy pastry triangles filled with spiced potatoes and peas a popular Indian appetizer,2 cups all-purpose flour||1/2 teaspoon salt||4 tablespoons vegetable oil||1/2 cup water||3 medium potatoes boiled and diced||1 cup green peas||2 tablespoons vegetable oil||1 teaspoon cumin seeds||1 onion finely chopped||2 cloves garlic minced||1 tablespoon ginger grated||1 green chili finely chopped (optional)||1 teaspoon ground cumin||1 teaspoon ground coriander||1/2 teaspoon turmeric||1/2 teaspoon garam masala||2 tablespoons fresh cilantro chopped||Salt to taste||Oil for deep frying||Mint chutney for serving,For the dough mix flour and salt in a bowl Add oil and rub until mixture resembles breadcrumbs||Gradually add water and knead to form a firm dough Cover and let rest for 30 minutes||For the filling heat oil in a pan and add cumin seeds When they splutter add onion garlic ginger and green chili||Cook until onions are golden brown then add ground spices and cook for 1 minute||Add potatoes and peas mix well Season with salt and cook for 3-4 minutes||Stir in cilantro and remove from heat Let the filling cool completely||Divide the dough into 10-12 equal portions Roll each portion into a circle about 6 inches in diameter||Cut each circle in half Wet the straight edge with water and form a cone||Fill the cone with about 2 tablespoons of the potato mixture||Seal the open edge by pressing firmly||Heat oil to 350°F (175°C) and deep fry samosas until golden brown about 3-4 minutes per batch||Drain on paper towels and serve hot with mint chutney,vegetarian,vegan,indian,fried,45,60,12,Hard,4.8,appetizer,published,345,189,2024-01-15 20:00:00,2024-01-15 20:00:00,,
21,Avocado Toast Bites,avocado-toast-bites,images/avocado-toast-bites.jpg,,Bite-sized pieces of toasted baguette topped with creamy avocado cherry tomatoes and a sprinkle of everything bagel seasoning,1 baguette sliced into 1/2-inch rounds||3 tablespoons olive oil||2 ripe avocados||1 tablespoon lemon juice||1/2 teaspoon salt||1/4 teaspoon black pepper||1 cup cherry tomatoes halved||2 tablespoons red onion finely diced||2 tablespoons everything bagel seasoning||Fresh microgreens for garnish (optional),Preheat oven to 375°F (190°C)||Brush baguette slices with olive oil on both sides and place on a baking sheet||Bake for 5-7 minutes until lightly toasted||In a bowl mash avocados with lemon juice salt and pepper||Spread avocado mixture on toasted baguette slices||Top each with cherry tomato halves and diced red onion||Sprinkle with everything bagel seasoning||Garnish with microgreens if desired||Serve immediately,vegetarian,vegan,quick,healthy,15,15,12,Easy,4.6,appetizer,published,267,142,2024-01-15 20:30:00,2024-01-15 20:30:00,,
22,Sweet Potato Chickpea Bites,sweet-potato-chickpea-bites,images/sweet-potato-bites.jpg,,Roasted sweet potato rounds topped with a flavorful chickpea and herb salad,2 large sweet potatoes sliced into 1/2-inch rounds||2 tablespoons olive oil||1 teaspoon salt||1/2 teaspoon paprika||1 can (15 oz) chickpeas drained and rinsed||1/4 cup red bell pepper finely diced||1/4 cup cucumber finely diced||2 tablespoons red onion finely diced||2 tablespoons fresh parsley chopped||1 tablespoon fresh mint chopped||2 tablespoons lemon juice||1 tablespoon olive oil||1/2 teaspoon cumin||1/4 teaspoon salt||1/4 teaspoon black pepper,Preheat oven to 425°F (220°C) Line a baking sheet with parchment paper||Toss sweet potato rounds with olive oil salt and paprika||Arrange in a single layer on baking sheet and roast for 20-25 minutes flipping halfway through until tender and slightly crispy on edges||Meanwhile in a bowl combine chickpeas bell pepper cucumber red onion parsley and mint||In a small bowl whisk together lemon juice olive oil cumin salt and pepper||Pour dressing over chickpea mixture and toss to combine||Once sweet potatoes are done let cool slightly then top each round with a spoonful of chickpea salad||Arrange on a serving platter and serve warm or at room temperature,vegetarian,vegan,gluten-free,healthy,15,25,12,Medium,4.7,appetizer,published,198,123,2024-01-15 21:00:00,2024-01-15 21:00:00,,
