id,title,slug,image,video_path,description,ingredients,instructions,tags,prep_time,cook_time,servings,difficulty,rating,category,status,views,likes,created_at,updated_at,video_url,video_file
23,Crispy Zucchini Fritters,crispy-zucchini-fritters,images/zucchini-fritters.jpg,,Golden crispy zucchini fritters served with a cool yogurt dipping sauce,2 medium zucchini grated||1 teaspoon salt plus more to taste||1/4 cup all-purpose flour||1/4 cup cornstarch||2 green onions finely chopped||2 tablespoons fresh dill chopped||1 clove garlic minced||1 egg beaten||1/4 teaspoon black pepper||Vegetable oil for frying||1 cup plain Greek yogurt||1 tablespoon lemon juice||1 tablespoon fresh mint chopped||1/2 teaspoon garlic powder||Salt and pepper to taste,Place grated zucchini in a colander sprinkle with 1 teaspoon salt and let sit for 10 minutes||Squeeze out as much moisture as possible from the zucchini using a clean kitchen towel||In a large bowl combine zucchini flour cornstarch green onions dill garlic egg and pepper||Heat 1/4 inch of oil in a large skillet over medium heat||Drop heaping tablespoons of batter into the hot oil and flatten slightly||Cook for 2-3 minutes per side until golden brown and crispy||Drain on paper towels and sprinkle with salt while still hot||For the sauce mix Greek yogurt lemon juice mint garlic powder salt and pepper||Serve fritters hot with yogurt sauce on the side,vegetarian,fried,party food,20,30,6,Medium,4.6,appetizer,published,234,156,2024-01-15 21:30:00,2024-01-15 21:30:00,,
24,Watermelon Feta Skewers,watermelon-feta-skewers,images/watermelon-feta.jpg,,Refreshing skewers with sweet watermelon tangy feta cheese and fresh mint drizzled with balsamic glaze,1 small watermelon cut into 1-inch cubes||8 oz feta cheese cut into 1/2-inch cubes||1/4 cup fresh mint leaves||3 tablespoons balsamic glaze||2 tablespoons extra virgin olive oil||Freshly ground black pepper||24 small skewers or toothpicks,Thread a watermelon cube followed by a mint leaf and then a feta cube onto each skewer||Arrange on a serving platter||Drizzle with balsamic glaze and olive oil||Finish with a sprinkle of freshly ground black pepper||Serve immediately or refrigerate until ready to serve (no more than 1 hour),vegetarian,gluten-free,no-cook,summer,quick,15,0,12,Easy,4.5,appetizer,published,189,98,2024-01-15 22:00:00,2024-01-15 22:00:00,,
25,Smoky Baba Ganoush,smoky-baba-ganoush,images/baba-ganoush.jpg,,Creamy smoky eggplant dip served with homemade crispy pita chips,2 large eggplants||3 tablespoons tahini||2 cloves garlic minced||2 tablespoons lemon juice||1 tablespoon olive oil plus more for drizzling||1/2 teaspoon ground cumin||1/4 teaspoon smoked paprika plus more for garnish||Salt and pepper to taste||2 tablespoons fresh parsley chopped||6 pita breads||2 tablespoons olive oil||1 teaspoon za'atar seasoning (optional),Preheat oven to 450°F (230°C)||Prick eggplants all over with a fork and place on a baking sheet||Roast for 30-40 minutes until skin is charred and flesh is soft||Let cool then cut in half and scoop out the flesh into a colander Let drain for 10 minutes||Transfer eggplant to a food processor Add tahini garlic lemon juice olive oil cumin smoked paprika salt and pepper||Pulse until smooth but still slightly textured||For pita chips reduce oven to 375°F (190°C)||Cut each pita into 8 triangles Brush with olive oil and sprinkle with za'atar if using||Bake for 10-12 minutes until crispy and golden||Serve baba ganoush in a bowl drizzled with olive oil sprinkled with smoked paprika and parsley with pita chips on the side,vegetarian,vegan,mediterranean,make ahead,35,50,6,Medium,4.7,appetizer,published,267,134,2024-01-15 22:30:00,2024-01-15 22:30:00,,
26,Cucumber Cream Cheese Canapes,cucumber-cream-cheese-canapes,images/cucumber-canapes.jpg,,Fresh cucumber rounds topped with herb-infused cream cheese and garnished with radish and dill,2 English cucumbers||8 oz cream cheese softened||2 tablespoons fresh dill chopped||2 tablespoons fresh chives chopped||1 tablespoon lemon zest||1 clove garlic minced||Salt and pepper to taste||4 radishes thinly sliced||Fresh dill sprigs for garnish||Paprika for dusting,Slice cucumbers into 1/4-inch thick rounds||In a bowl combine cream cheese dill chives lemon zest garlic salt and pepper||Using a small spoon or piping bag add a dollop of the cream cheese mixture onto each cucumber round||Top each with a radish slice and a small sprig of dill||Dust lightly with paprika for color||Arrange on a serving platter and refrigerate until ready to serve,vegetarian,gluten-free,low-carb,no-cook,quick,20,0,12,Easy,4.4,appetizer,published,156,87,2024-01-15 23:00:00,2024-01-15 23:00:00,,
27,Crispy Vegetable Pakoras,vegetable-pakoras,images/pakoras.jpg,,Crispy Indian fritters made with assorted vegetables in a spiced chickpea batter,1 cup chickpea flour (besan)||1/2 teaspoon baking powder||1 teaspoon ground cumin||1 teaspoon ground coriander||1/2 teaspoon turmeric||1/4 teaspoon cayenne pepper||1/2 teaspoon salt||3/4 cup water||1 small onion thinly sliced||1 potato thinly sliced||1 bell pepper thinly sliced||1 cup spinach leaves||1/4 cup fresh cilantro chopped||1 green chili finely chopped (optional)||Vegetable oil for deep frying||Mint chutney for serving,In a large bowl combine chickpea flour baking powder cumin coriander turmeric cayenne pepper and salt||Gradually add water whisking to form a smooth batter (consistency of thick pancake batter)||Add vegetables cilantro and green chili if using Mix well to coat all vegetables||Heat oil in a deep pan or wok to 350°F (175°C)||Drop spoonfuls of the vegetable mixture into the hot oil||Fry in batches for 3-4 minutes until golden brown and crispy||Drain on paper towels and serve hot with mint chutney,vegetarian,vegan,indian,fried,gluten-free,20,30,6,Medium,4.8,appetizer,published,298,167,2024-01-15 23:30:00,2024-01-15 23:30:00,,
28,Almond Stuffed Dates,almond-stuffed-dates,images/stuffed-dates.jpg,,Sweet Medjool dates stuffed with crunchy almonds and brightened with orange zest,24 Medjool dates||24 whole almonds roasted and unsalted||1 orange zested||1/4 teaspoon cinnamon||2 tablespoons honey||2 tablespoons pistachios finely chopped (for garnish),Make a lengthwise slit in each date and remove the pit||Insert an almond into each date||Arrange dates on a serving plate||In a small bowl mix orange zest and cinnamon||Drizzle honey over the dates||Sprinkle