id,title,slug,image,video_url,video_path,video_file,description,ingredients,instructions,recipe_notes,tags,prep_time,cook_time,total_time,servings,difficulty,rating,rating_count,category,cuisine_type,dietary_restrictions,calories_per_serving,protein_per_serving,carbs_per_serving,fat_per_serving,fiber_per_serving,sugar_per_serving,sodium_per_serving,status,views,likes,author_id,featured,created_at,updated_at,uploaded_by_user_id,is_user_recipe,moderation_status,moderator_notes
202,"Chicken Wings","chicken-wings","images/chicken-wings.jpg","","","","Spicy buffalo chicken wings","2 lbs chicken wings||1/2 cup hot sauce||1/4 cup butter||1 tsp garlic powder||1 tsp paprika||Salt and pepper||Oil for frying||Blue cheese dressing","Season wings with salt, pepper, garlic powder||Deep fry until crispy||Melt butter, mix with hot sauce||Toss wings in buffalo sauce||Serve with blue cheese dressing and celery","Can be baked instead of fried for healthier option","snacks,american,chicken,spicy,protein","15 mins","25 mins","40 mins",8,"Medium",4.8,41,"snacks","American","",245,22.5,2.8,16.5,0.2,1.2,785.5,"published",367,94,1,1,"2025-06-21 08:00:00","2025-06-21 08:00:00",,"0","approved",
203,"Nachos with Cheese","nachos-with-cheese","images/nachos.jpg","","","","Crispy tortilla chips with melted cheese sauce","1 bag tortilla chips||2 cups shredded cheddar cheese||1/2 cup milk||1 jalapeño sliced||1/4 cup sour cream||2 tbsp salsa||Green onions for garnish","Arrange chips on baking sheet||Sprinkle with cheese||Bake until cheese melts||Top with jalapeños, sour cream, salsa||Garnish with green onions||Serve immediately","Add ground beef or chicken for protein","snacks,mexican,cheese,baked,party","10 mins","15 mins","25 mins",6,"Easy",4.6,28,"snacks","Mexican","vegetarian",285,12.8,25.5,16.2,3.2,2.8,685.5,"published",198,56,1,0,"2025-06-21 08:00:00","2025-06-21 08:00:00",,"0","approved",
204,"Onion Rings","onion-rings","images/onion-rings.jpg","","","","Crispy beer-battered onion rings","2 large onions||1 cup flour||1 cup beer||1 tsp baking powder||1 tsp salt||1/2 tsp paprika||Oil for frying||Ranch dressing for dipping","Slice onions into thick rings||Make batter with flour, beer, baking powder||Dip onion rings in batter||Deep fry until golden and crispy||Drain on paper towels||Serve with ranch dressing","Use cold beer for crispier batter","snacks,american,fried,crispy,vegetarian","15 mins","20 mins","35 mins",6,"Medium",4.5,23,"snacks","American","vegetarian",165,3.5,22.8,7.2,2.1,4.5,285.8,"published",176,41,1,0,"2025-06-21 08:00:00","2025-06-21 08:00:00",,"0","approved",
205,"Popcorn Chicken","popcorn-chicken","images/popcorn-chicken.jpg","","","","Bite-sized crispy chicken pieces","1 lb chicken breast||1 cup flour||2 eggs||1 cup breadcrumbs||1 tsp garlic powder||1 tsp paprika||Salt and pepper||Oil for frying||Honey mustard sauce","Cut chicken into bite-sized pieces||Season with salt, pepper, garlic powder||Dip in flour, egg, then breadcrumbs||Deep fry until golden and cooked through||Serve with honey mustard sauce","Perfect for parties and movie nights","snacks,american,chicken,fried,crispy","20 mins","15 mins","35 mins",6,"Medium",4.7,35,"snacks","American","",205,18.5,12.8,10.2,0.8,1.5,385.5,"published",234,67,1,1,"2025-06-21 08:00:00","2025-06-21 08:00:00",,"0","approved",
206,"Stuffed Jalapeño Poppers","stuffed-jalapeno-poppers","images/jalapeno-poppers.jpg","","","","Spicy jalapeños stuffed with cream cheese","12 jalapeño peppers||8 oz cream cheese||1 cup shredded cheddar||4 strips bacon||1/2 cup breadcrumbs||1 egg||Oil for frying","Cut jalapeños in half, remove seeds||Mix cream cheese and cheddar||Stuff jalapeños with cheese mixture||Wrap with bacon or coat with breadcrumbs||Bake or fry until golden||Serve hot","Wear gloves when handling jalapeños","snacks,american,spicy,cheese,appetizer","20 mins","20 mins","40 mins",6,"Medium",4.8,29,"snacks","American","",185,8.5,6.2,14.8,1.2,2.8,485.5,"published",203,58,1,1,"2025-06-21 08:00:00","2025-06-21 08:00:00",,"0","approved",
207,"Samosa","samosa","images/samosa.jpg","","","","Crispy triangular pastry with spiced potato filling","2 cups flour||1/2 cup oil||1 tsp salt||4 potatoes||1 tsp cumin seeds||1 tsp coriander seeds||2 green chilies||1 inch ginger||1 tsp garam masala||Oil for frying","Make dough with flour, oil, salt||Boil and cube potatoes||Sauté spices, add potatoes||Make small circles with dough||Fill and shape into triangles||Deep fry until golden","Classic Indian snack loved worldwide","snacks,indian,fried,spicy,vegetarian","40 mins","25 mins","65 mins",10,"Medium",4.6,38,"snacks","Indian","vegetarian",155,3.2,22.5,6.8,2.5,2.1,245.5,"published",287,78,1,1,"2025-06-21 08:00:00","2025-06-21 08:00:00",,"0","approved",
208,"Pakora","pakora","images/pakora.jpg","","","","Mixed vegetable fritters in chickpea batter","1 cup chickpea flour||1 onion sliced||1 potato sliced||1/2 cup cauliflower||2 green chilies||1 tsp ginger paste||1 tsp red chili powder||1/2 tsp turmeric||Salt to taste||Oil for frying","Mix chickpea flour with spices and water||Add vegetables to batter||Deep fry spoonfuls until golden||Drain on paper towels||Serve hot with mint chutney","Perfect for rainy days with tea","snacks,indian,fried,vegetarian,monsoon","15 mins","20 mins","35 mins",6,"Easy",4.5,26,"snacks","Indian","vegetarian,gluten-free",135,4.8,15.2,6.5,3.2,3.1,285.2,"published",198,45,1,0,"2025-06-21 08:00:00","2025-06-21 08:00:00",,"0","approved",
209,"Dhokla","dhokla","images/dhokla.jpg","","","","Steamed savory cake from Gujarat","1 cup chickpea flour||1/2 cup water||1 tsp ginger paste||1 green chili||1 tsp lemon juice||1/2 tsp turmeric||1 tsp eno||1 tsp mustard seeds||Curry leaves||Oil for tempering","Mix chickpea flour with water and spices||Add eno and steam for 15 minutes||Prepare tempering with mustard seeds||Pour over steamed dhokla||Cut into squares and serve","Light and healthy steamed snack","snacks,indian,steamed,healthy,vegetarian","15 mins","20 mins","35 mins",8,"Medium",4.7,22,"snacks","Indian","vegetarian,gluten-free",95,4.2,14.8,2.5,2.8,2.1,185.5,"published",167,39,1,0,"2025-06-21 08:00:00","2025-06-21 08:00:00",,"0","approved",
210,"Aloo Bhujia","aloo-bhujia","images/aloo-bhujia.jpg","","","","Crispy potato noodle snack","2 cups gram flour||1/2 cup rice flour||1 tsp red chili powder||1/2 tsp turmeric||1 tsp salt||1 tsp carom seeds||Water as needed||Oil for frying","Mix all dry ingredients||Add water to make stiff dough||Press through bhujia maker or fine holes||Deep fry until crispy||Store in airtight container","Popular packaged snack made at home","snacks,indian,crispy,spicy,vegetarian","20 mins","30 mins","50 mins",10,"Medium",4.4,18,"snacks","Indian","vegetarian,gluten-free",145,3.8,18.5,6.2,2.1,1.8,385.5,"published",134,31,1,0,"2025-06-21 08:00:00","2025-06-21 08:00:00",,"0","approved",
211,"Banana Chips","banana-chips","images/banana-chips.jpg","","","","Crispy fried banana slices","4 raw bananas||1 tsp turmeric||Salt to taste||Oil for frying","Peel and slice bananas thinly||Mix with turmeric and salt||Heat oil and fry until golden||Drain on paper towels||Store in airtight container","Popular South Indian snack","snacks,indian,crispy,healthy,vegetarian","15 mins","20 mins","35 mins",6,"Easy",4.3,15,"snacks","Indian","vegetarian,gluten-free",125,1.8,22.5,4.2,2.8,12.5,185.2,"published",123,28,1,0,"2025-06-21 08:00:00","2025-06-21 08:00:00",,"0","approved",
212,"Murukku","murukku","images/murukku.jpg","","","","Spiral-shaped crispy rice snack","2 cups rice flour||1/4 cup urad dal flour||1 tsp cumin seeds||1 tsp sesame seeds||2 tbsp butter||1 tsp salt||Water as needed||Oil for frying","Mix rice flour, urad dal flour, and spices||Add butter and water to make dough||Press through murukku maker||Deep fry until golden||Cool and store","Traditional South Indian snack","snacks,indian,crispy,rice,vegetarian","25 mins","25 mins","50 mins",8,"Medium",4.6,21,"snacks","Indian","vegetarian,gluten-free",165,3.5,24.8,6.2,1.8,1.2,285.5,"published",156,36,1,0,"2025-06-21 08:00:00","2025-06-21 08:00:00",,"0","approved",
213,"Potato Wedges","potato-wedges","images/potato-wedges.jpg","","","","Crispy seasoned potato wedges","4 large potatoes||2 tbsp olive oil||1 tsp paprika||1 tsp garlic powder||1 tsp salt||1/2 tsp black pepper||Sour cream for dipping","Cut potatoes into wedges||Toss with oil and seasonings||Bake at 425°F for 35-40 minutes||Turn halfway through cooking||Serve with sour cream","Healthier alternative to french fries","snacks,american,baked,potato,crispy","15 mins","40 mins","55 mins",6,"Easy",4.5,27,"snacks","American","vegetarian,gluten-free",165,3.2,28.5,5.2,3.8,2.1,285.5,"published",189,43,1,0,"2025-06-21 08:00:00","2025-06-21 08:00:00",,"0","approved",
214,"Deviled Eggs","deviled-eggs","images/deviled-eggs.jpg","","","","Classic American appetizer with creamy yolk filling","6 hard-boiled eggs||3 tbsp mayonnaise||1 tsp mustard||1 tsp vinegar||Salt and pepper||Paprika for garnish","Cut eggs in half, remove yolks||Mash yolks with mayo, mustard, vinegar||Season with salt and pepper||Pipe mixture back into egg whites||Sprinkle with paprika||Chill before serving","Perfect for parties and picnics","snacks,american,eggs,creamy,appetizer","15 mins","0 mins","15 mins",6,"Easy",4.6,24,"snacks","American","vegetarian",95,6.8,1.2,7.5,0.1,0.8,125.5,"published",167,38,1,0,"2025-06-21 08:00:00","2025-06-21 08:00:00",,"0","approved",
215,"Mini Quiche","mini-quiche","images/mini-quiche.jpg","","","","Bite-sized egg custard tarts","12 mini tart shells||4 eggs||1/2 cup cream||1/4 cup cheese||2 tbsp bacon bits||1 green onion||Salt and pepper||Nutmeg pinch","Preheat oven to 375°F||Whisk eggs with cream||Add cheese, bacon, onion||Season with salt, pepper, nutmeg||Fill tart shells with mixture||Bake for 15-20 minutes until set","Great for brunch or appetizers","snacks,french,eggs,baked,appetizer","15 mins","20 mins","35 mins",6,"Medium",4.7,31,"snacks","French","",145,8.5,8.2,10.5,0.5,1.8,285.5,"published",203,56,1,1,"2025-06-21 08:00:00","2025-06-21 08:00:00",,"0","approved",
216,"Cheese Balls","cheese-balls","images/cheese-balls.jpg","","","","Crispy fried cheese balls","2 cups shredded cheese||1/4 cup flour||1 egg||1 cup breadcrumbs||1/4 tsp garlic powder||Salt and pepper||Oil for frying","Mix cheese with flour and seasonings||Form into small balls||Dip in beaten egg||Roll in breadcrumbs||Deep fry until golden||Serve hot with marinara","Kids love these cheesy treats","snacks,american,cheese,fried,kids","20 mins","15 mins","35 mins",8,"Medium",4.5,26,"snacks","American","vegetarian",175,8.8,12.5,11.2,0.8,1.5,385.5,"published",187,42,1,0,"2025-06-21 08:00:00","2025-06-21 08:00:00",,"0","approved",